{
  "schema_version": 1,
  "features": ["F-CEC-006", "F-CEC-007", "F-API-015"],
  "level": "V2",
  "scenario": "cec_controls.output_5_volume_up",
  "scenario_title": "HTTP CEC output 5: volume_up, auto-enable only that target",
  "scenario_kind": "happy",
  "target": "sim",
  "client": "api",
  "result": "pass",
  "gate": "ok",
  "blocked_reason": null,
  "commit": {
    "sha": "b30436afd26eba01a32f2202063ad187477d0066",
    "branch": "fix-backend-wp-v2-bugs",
    "dirty_files": [],
    "short": "b30436af",
    "dirty": false
  },
  "timestamp": {
    "started": "2026-10-03T21:47:53.866Z",
    "finished": "2026-10-03T21:47:54.002Z"
  },
  "operator": "automation",
  "environment": {
    "target": "sim",
    "python": "3.12.10",
    "platform": "Windows-11-10.0.26200-SP0",
    "hub": {
      "entry": "http://127.0.0.1:50324",
      "version": "2.10.0",
      "api_version": "2.10.0",
      "image_digest": "sha256:069076733456776b1b9b4be9c490b35f64293ea289dae6cc23ebf80da4abd14a",
      "env": {
        "UC_ENABLED": "false",
        "MATRIX_HOST": "domain-matrix",
        "MATRIX_PORT": "8443",
        "OREI_TELNET_PORT": "2323",
        "OREI_USE_TELNET_CEC": "false",
        "TRUST_PROXY_HEADERS": "true",
        "TRUSTED_PROXY_IPS": "127.0.0.1,172.16.0.0/12,192.168.0.0/16",
        "LOG_LEVEL": "INFO"
      }
    },
    "client": {
      "name": "api",
      "aiohttp": "3.13.3"
    },
    "simulator": {
      "source_sha256": "23f7439ea94f5fcc",
      "seed_state": "tools/simulator/states/default.json",
      "model": "BK-808",
      "firmware_version": "V1.10.01",
      "web_version": "V2.00.03"
    }
  },
  "procedure": [
    "reset the simulator to the seed state + {'inputs': {'0': {'cec_enabled': 0}, '1': {'cec_enabled': 1}, '2': {'cec_enabled': 0}, '3': {'cec_enabled': 1}, '4': {'cec_enabled': 1}, '5': {'cec_enabled': 0}, '6': {'cec_enabled': 1}, '7': {'cec_enabled': 0}}, 'outputs': {'0': {'cec_enabled': 1}, '1': {'cec_enabled': 0}, '2': {'cec_enabled': 1}, '3': {'cec_enabled': 0}, '4': {'cec_enabled': 0}, '5': {'cec_enabled': 1}, '6': {'cec_enabled': 0}, '7': {'cec_enabled': 1}}}",
    "let the hub read the matrix (/ws get_status), so it is in sync before the action",
    "setup (api): request(method='GET', path='/api/status/cec') -> HTTP 200",
    "action (api): cec_output(output=5, command='volume_up')",
    "  POST /api/cec/output/5/volume_up -> HTTP 200"
  ],
  "observations": {
    "requests": [
      {
        "method": "POST",
        "path": "/api/cec/output/5/volume_up",
        "body": null,
        "status": 200,
        "response": {
          "success": true,
          "data": {
            "output": 5,
            "command": "volume_up",
            "message": "CEC volume_up sent to output 5"
          },
          "error": null
        },
        "elapsed_ms": 5.1
      }
    ],
    "response_status": 200,
    "hub_reads": [
      {
        "method": "GET",
        "path": "/api/status/cec",
        "body": null,
        "status": 200,
        "response": {
          "success": true,
          "data": {
            "cec_config": {
              "inputs": [
                {
                  "number": 1,
                  "name": "Input 1",
                  "cec_enabled": false
                },
                {
                  "number": 2,
                  "name": "Input 2",
                  "cec_enabled": true
                },
                {
                  "number": 3,
                  "name": "Input 3",
                  "cec_enabled": false
                },
                {
                  "number": 4,
                  "name": "Input 4",
                  "cec_enabled": true
                },
                {
                  "number": 5,
                  "name": "Input 5",
                  "cec_enabled": true
                },
                {
                  "number": 6,
                  "name": "Input 6",
                  "cec_enabled": false
                },
                {
                  "number": 7,
                  "name": "Input 7",
                  "cec_enabled": true
                },
                {
                  "number": 8,
                  "name": "Input 8",
                  "cec_enabled": false
                }
              ],
              "outputs": [
                {
                  "number": 1,
                  "cec_enabled": true
                },
                {
                  "number": 2,
                  "cec_enabled": false
                },
                {
                  "number": 3,
                  "cec_enabled": true
                },
                {
                  "number": 4,
                  "cec_enabled": false
                },
                {
                  "number": 5,
                  "cec_enabled": true
                },
                {
                  "number": 6,
                  "cec_enabled": true
                },
                {
                  "number": 7,
                  "cec_enabled": false
                },
                {
                  "number": 8,
                  "cec_enabled": true
                }
              ]
            },
            "raw": {
              "comhead": "get cec status",
              "power": 1,
              "allinputname": ["PS3", "AppleTV", "Computer", "Switch", "Shield", "PS5", "Analogue", "Input 8"],
              "alloutputname": ["TV", "Soundbar", "Output 3", "Output 4", "Output 5", "Output 6", "Output 7", "Output 8"],
              "inputindex": [0, 1, 0, 1, 1, 0, 1, 0],
              "outputindex": [1, 0, 1, 0, 1, 1, 0, 1]
            }
          },
          "error": null
        },
        "elapsed_ms": 2.1
      },
      {
        "method": "GET",
        "path": "/api/status/cec",
        "body": null,
        "status": 200,
        "response": {
          "success": true,
          "data": {
            "cec_config": {
              "inputs": [
                {
                  "number": 1,
                  "name": "Input 1",
                  "cec_enabled": false
                },
                {
                  "number": 2,
                  "name": "Input 2",
                  "cec_enabled": true
                },
                {
                  "number": 3,
                  "name": "Input 3",
                  "cec_enabled": false
                },
                {
                  "number": 4,
                  "name": "Input 4",
                  "cec_enabled": true
                },
                {
                  "number": 5,
                  "name": "Input 5",
                  "cec_enabled": true
                },
                {
                  "number": 6,
                  "name": "Input 6",
                  "cec_enabled": false
                },
                {
                  "number": 7,
                  "name": "Input 7",
                  "cec_enabled": true
                },
                {
                  "number": 8,
                  "name": "Input 8",
                  "cec_enabled": false
                }
              ],
              "outputs": [
                {
                  "number": 1,
                  "cec_enabled": true
                },
                {
                  "number": 2,
                  "cec_enabled": false
                },
                {
                  "number": 3,
                  "cec_enabled": true
                },
                {
                  "number": 4,
                  "cec_enabled": false
                },
                {
                  "number": 5,
                  "cec_enabled": true
                },
                {
                  "number": 6,
                  "cec_enabled": true
                },
                {
                  "number": 7,
                  "cec_enabled": false
                },
                {
                  "number": 8,
                  "cec_enabled": true
                }
              ]
            },
            "raw": {
              "comhead": "get cec status",
              "power": 1,
              "allinputname": ["PS3", "AppleTV", "Computer", "Switch", "Shield", "PS5", "Analogue", "Input 8"],
              "alloutputname": ["TV", "Soundbar", "Output 3", "Output 4", "Output 5", "Output 6", "Output 7", "Output 8"],
              "inputindex": [0, 1, 0, 1, 1, 0, 1, 0],
              "outputindex": [1, 0, 1, 0, 1, 1, 0, 1]
            }
          },
          "error": null
        },
        "elapsed_ms": 2.5
      }
    ],
    "state_before": {
      "schema_version": 1,
      "auth": {
        "user": "Admin",
        "password": "admin"
      },
      "device": {
        "model": "BK-808",
        "hostname": "BK-808",
        "firmware_version": "V1.10.01",
        "web_version": "V2.00.03",
        "key_mcu_version": "V1.00.08",
        "cpld_version": "V1.00.06",
        "type": "8x8 hdmi2.1 matrix",
        "ip_module_version": "10.01.17",
        "mac_address": "02:00:00:0B:08:08",
        "ip_address": "192.168.0.100",
        "netmask": "255.255.255.0",
        "gateway": "192.168.0.1",
        "dhcp": 0,
        "telnet_port": 23,
        "tcp_port": 8000,
        "network_username": 1
      },
      "system": {
        "power": 1,
        "beep": 1,
        "panel_lock": 0,
        "lcd_timeout": 3,
        "baudrate": 6
      },
      "inputs": [
        {
          "name": "PS3",
          "edid": 36,
          "signal": 0,
          "cable": 1,
          "cec_enabled": 0
        },
        {
          "name": "AppleTV",
          "edid": 36,
          "signal": 1,
          "cable": 1,
          "cec_enabled": 1
        },
        {
          "name": "Computer",
          "edid": 3,
          "signal": 0,
          "cable": 0,
          "cec_enabled": 0
        },
        {
          "name": "Switch",
          "edid": 36,
          "signal": 0,
          "cable": 1,
          "cec_enabled": 1